ID,Data_Pub,Link,Titulo,Aba,Views,Local,Status,Data_Extracao
Z58ml_rn65Q,23/06/2026,https://www.youtube.com/watch?v=Z58ml_rn65Q,"SEFAZ SP: Conheça Gabriel Santos, aprovado em 32° lugar para Auditor Fiscal",Videos,NA,EstrategiaConcursosBrasil_Parte_1,Sucesso,2026-06-23
mF1JyIFnCuQ,23/06/2026,https://www.youtube.com/watch?v=mF1JyIFnCuQ,"Concurso TCE-RN: conheça Micael Felipe do Santos, 1° lugar (PCD) para Analista Administrativo - TI!",Videos,NA,EstrategiaConcursosBrasil_Parte_1,Sucesso,2026-06-23
uXUhKcQsDWw,22/06/2026,https://www.youtube.com/watch?v=uXUhKcQsDWw,"Concurso TCE-RN: Conheça Jose Felipe da Rocha Oliveira, 6° lugar para Técnico Administrativo!",Videos,NA,EstrategiaConcursosBrasil_Parte_1,Sucesso,2026-06-23
EAnNrDi1VUA,22/06/2026,https://www.youtube.com/watch?v=EAnNrDi1VUA,Concursos Abertos,Videos,NA,EstrategiaConcursosBrasil_Parte_1,Sucesso,2026-06-23
BH0qMMcUaO4,22/06/2026,https://www.youtube.com/watch?v=BH0qMMcUaO4,"MP SE: Athos Miguel Ferreira Dantas, aprovado em 6º lugar para Técnico do Ministério Público",Videos,NA,EstrategiaConcursosBrasil_Parte_1,Sucesso,2026-06-23
Wm4UNs9lbdo,21/06/2026,https://www.youtube.com/watch?v=Wm4UNs9lbdo,"ALERJ: Alessandro Magno, aprovado em 4º lugar para Especialista Legislativo - RH",Videos,NA,EstrategiaConcursosBrasil_Parte_1,Sucesso,2026-06-23
Ym6iaeJq0UA,21/06/2026,https://www.youtube.com/watch?v=Ym6iaeJq0UA,"Nahtti Coelho: aprovada em diversos concursos da área fiscal, controle e legislativa",Videos,NA,EstrategiaConcursosBrasil_Parte_1,Sucesso,2026-06-23
Sx4S51KkDOE,20/06/2026,https://www.youtube.com/watch?v=Sx4S51KkDOE,"DEGASE RJ: Ana Paula Porto, aprovada para o cargo de Agente Administrativo",Videos,NA,EstrategiaConcursosBrasil_Parte_1,Sucesso,2026-06-23
0eDhrS5b4Vk,20/06/2026,https://www.youtube.com/watch?v=0eDhrS5b4Vk,"MP SE: Lhaysla Manuelle Oliveira, aprovada em 2º lugar para Técnico do MP - Área Administrativa",Videos,NA,EstrategiaConcursosBrasil_Parte_1,Sucesso,2026-06-23
iNUz2oMHz1U,19/06/2026,https://www.youtube.com/watch?v=iNUz2oMHz1U,"Fiocruz: Conheça Leiza Kovarik, aprovada para Analista de Gestão em Saúde",Videos,NA,EstrategiaConcursosBrasil_Parte_1,Sucesso,2026-06-23
1E5g6Ymo27g,19/06/2026,https://www.youtube.com/watch?v=1E5g6Ymo27g,"Concurso TCE-RN: conheça Shalom Macedo, 1° lugar para Auditor de Controle Externo - Engenharia Civil",Videos,NA,EstrategiaConcursosBrasil_Parte_1,Sucesso,2026-06-23
Se06oXnlmI4,18/06/2026,https://www.youtube.com/watch?v=Se06oXnlmI4,"SEFAZ-RN: Conheça Marco Abla, aprovado em 3º lugar para Auditor Fiscal",Videos,NA,EstrategiaConcursosBrasil_Parte_1,Sucesso,2026-06-23
mfPe6TU0i9k,18/06/2026,https://www.youtube.com/watch?v=mfPe6TU0i9k,"TJ-RJ: Gelson Rodrigues, aprovado em 2º lugar para Analista Judiciário - Analista de Projetos(TI)",Videos,NA,EstrategiaConcursosBrasil_Parte_1,Sucesso,2026-06-23
h34PFjjyXbk,17/06/2026,https://www.youtube.com/watch?v=h34PFjjyXbk,PC TO EXCLUSIVO: Secretário de Segurança confirma EDITAL em AGOSTO e detalha ETAPAS DE PROVA!,Videos,NA,EstrategiaConcursosBrasil_Parte_2,Sucesso,2026-06-23
J5zVkTmPr_M,17/06/2026,https://www.youtube.com/watch?v=J5zVkTmPr_M,Concurso CGE SP: Renato Souza aprovado em 4º lugar - Auditor Estadual de Controle,Videos,NA,EstrategiaConcursosBrasil_Parte_2,Sucesso,2026-06-23
HZnvMpkxyXI,17/06/2026,https://www.youtube.com/watch?v=HZnvMpkxyXI,"SEFAZ-RN: Felipe Santos, aprovado em 5º lugar (cotas) para Auditor Fiscal",Videos,NA,EstrategiaConcursosBrasil_Parte_2,Sucesso,2026-06-23
EBJyAiatj48,16/06/2026,https://www.youtube.com/watch?v=EBJyAiatj48,"Concurso CGE SP: Hudson Morato, aprovado em 2º lugar na área de Tecnologia da Informação",Videos,NA,EstrategiaConcursosBrasil_Parte_2,Sucesso,2026-06-23
DeH_NJMv8R4,16/06/2026,https://www.youtube.com/watch?v=DeH_NJMv8R4,"Sefaz-SP: Conheça Fernando Batoqui França, aprovado para Auditor Fiscal - Gestão Tributária",Videos,NA,EstrategiaConcursosBrasil_Parte_2,Sucesso,2026-06-23
F_2l2FL81HE,15/06/2026,https://www.youtube.com/watch?v=F_2l2FL81HE,"Prefeitura de Catalão: Conheça Vinicius Milhome, aprovado em 1° lugar para Auditor Fiscal",Videos,NA,EstrategiaConcursosBrasil_Parte_2,Sucesso,2026-06-23
SysvQPyEYS4,15/06/2026,https://www.youtube.com/watch?v=SysvQPyEYS4,"TJ-RJ: Ulisses de Souza, aprovado em 3º lugar para Analista Judiciário - Analista de Gestão de TIC",Videos,NA,EstrategiaConcursosBrasil_Parte_2,Sucesso,2026-06-23
lGCHrJlITik,14/06/2026,https://www.youtube.com/watch?v=lGCHrJlITik,"Aprovado CPU PE, Lucas Pessoa compartilha rotina e trajetória que o trouxe o 1º lugar",Videos,NA,EstrategiaConcursosBrasil_Parte_2,Sucesso,2026-06-23
508YV4Ow64Y,13/06/2026,https://www.youtube.com/watch?v=508YV4Ow64Y,"Aprovada no Concurso Unificado de Pernambuco, Lívia Maria conta rotina e trajetória de estudos",Videos,NA,EstrategiaConcursosBrasil_Parte_2,Sucesso,2026-06-23
poadAyMvkCs,13/06/2026,https://www.youtube.com/watch?v=poadAyMvkCs,"TRF-5: Conheça Luan Victor, aprovado em 1º lugar para Analista Judiciário - Psicologia",Videos,NA,EstrategiaConcursosBrasil_Parte_2,Sucesso,2026-06-23
lM0tgRNBIew,12/06/2026,https://www.youtube.com/watch?v=lM0tgRNBIew,"DEGASE RJ: Maycon de Farias Teixeira, aprovado para o cargo de Agente Administrativo",Videos,NA,EstrategiaConcursosBrasil_Parte_2,Sucesso,2026-06-23
sF2jmVj9ugo,12/06/2026,https://www.youtube.com/watch?v=sF2jmVj9ugo,Ministério do Planejamento: Entrevista com o aprovado (e professor do Estratégia) Alexandre Baêta,Videos,NA,EstrategiaConcursosBrasil_Parte_2,Sucesso,2026-06-23
feRYVemOCio,11/06/2026,https://www.youtube.com/watch?v=feRYVemOCio,"DEGASE RJ: Gabriel Almeida, aprovado em 1º lugar para Agente de Segurança Socioeducativo",Videos,NA,EstrategiaConcursosBrasil_Parte_2,Sucesso,2026-06-23
IcL0FQKjjcw,11/06/2026,https://www.youtube.com/watch?v=IcL0FQKjjcw,"Sefaz-SP: Conheça Raphael Paixão, aprovado para Auditor Fiscal - Gestão Tributária",Videos,NA,EstrategiaConcursosBrasil_Parte_3,Sucesso,2026-06-23
OdpU7-3YztQ,10/06/2026,https://www.youtube.com/watch?v=OdpU7-3YztQ,"CGE-PE: Conheça Pedro Henrique, aprovado para Gestor Governamental - Finanças Públicas",Videos,NA,EstrategiaConcursosBrasil_Parte_3,Sucesso,2026-06-23
1aZM8W5FafY,10/06/2026,https://www.youtube.com/watch?v=1aZM8W5FafY,Concurso Sefaz RN: André Feijó - 7º lugar para Auditor Fiscal,Videos,NA,EstrategiaConcursosBrasil_Parte_3,Sucesso,2026-06-23
0B4stGzX4_A,09/06/2026,https://www.youtube.com/watch?v=0B4stGzX4_A,"SEFAZ SP: Conheça Bernardo Mendes, aprovado em 33º lugar para Auditor Fiscal",Videos,NA,EstrategiaConcursosBrasil_Parte_3,Sucesso,2026-06-23
R58KYzgW_Gg,09/06/2026,https://www.youtube.com/watch?v=R58KYzgW_Gg,"SEFAZ SP: Conheça Giovanna Ferrari, aprovada em 57º lugar para Auditor Fiscal",Videos,NA,EstrategiaConcursosBrasil_Parte_3,Sucesso,2026-06-23
uaCSLuylyU0,08/06/2026,https://www.youtube.com/watch?v=uaCSLuylyU0,"Comando da Aeronáutica: Conheça Sinara Barreto, aprovada em 2º lugar para o cargo de Contador",Videos,NA,EstrategiaConcursosBrasil_Parte_3,Sucesso,2026-06-23
1qhVnYjjfM4,08/06/2026,https://www.youtube.com/watch?v=1qhVnYjjfM4,"DEGASE RJ: Conheça Thiago Cleyton, aprovado para Agente Administrativo",Videos,NA,EstrategiaConcursosBrasil_Parte_3,Sucesso,2026-06-23
WGvlUNDFYy0,07/06/2026,https://www.youtube.com/watch?v=WGvlUNDFYy0,"SEFAZ PR: Conheça Ana Vitoria Lopes, aprovada em 6°lugar para Agente Fazendário Estadual",Videos,NA,EstrategiaConcursosBrasil_Parte_3,Sucesso,2026-06-23
